{
    "birthDate": "1972-01-10",
    "email": "Coralie44@yahoo.com",
    "firstName": "Prince",
    "lastName": "Howe",
    "gender": "female",
    "status": false,
    "idArray": [
        "JDl2YtHcTrS5fJJS1MO9ti34",
        "moxAwY7so2sfvzQeoO1rwtmw",
        "1CovtdouoymhjuRvJYtXJE66"
    ],
    "points": 78
}