{
    "id": "5HEiCAt6kcE4XaeuMfVftPWJ",
    "birthDate": "1952-08-25",
    "email": "Verna_Emard0@gmail.com",
    "firstName": "Marion",
    "lastName": "Olson",
    "gender": "female",
    "status": true,
    "createdAt": "2015-07-30T05:59:12.979Z",
    "updatedAt": "2015-07-30T05:59:12.979Z",
    "idArray": [
        "bVqKk6qQgaH8w8vf2V9VhkdG",
        "2sMgk5cwjUDl1GCHalVvCjr7",
        "UsBRMTwFnjd8UxRQ41flGKXb",
        "VrF1BzaUlReChIDmHQCq3iGv",
        "p5C9LzLUZSVURB1l1JTbIlJ4",
        "sRG4bAhIoKl9Wy7XSTAYY1Xz",
        "21enB6WoDARHDtGaBy0soQ9h",
        "LKAjkvtIi4FQMl8qibAXQMMQ",
        "SBpbYcmlF4NvjlNsShlNuxVk"
    ],
    "points": 84
}